[
  {
    "id": "rainer-001",
    "respondent_id": "rainer",
    "session_id": "s-p3-rainer",
    "captured_at": "2026-09-06T12:56:53Z",
    "question_id": "q1",
    "verbatim": "Petra, mainly.",
    "hedging": "firm",
    "polarity": "asserted",
    "subject_scope": "self",
    "entity_refs": [],
    "kind": "wait",
    "payload": {
      "waiting_on": "Petra",
      "owner": "internal",
      "current": true,
      "duration": null
    }
  },
  {
    "id": "rainer-002",
    "respondent_id": "rainer",
    "session_id": "s-p3-rainer",
    "captured_at": "2026-09-06T12:56:53Z",
    "question_id": "q1",
    "verbatim": "Availability, OEM lead times, whether the supposedly equivalent item is actually there.",
    "hedging": "firm",
    "polarity": "asserted",
    "subject_scope": "self",
    "entity_refs": [],
    "kind": "wait",
    "payload": {
      "waiting_on": "Availability, OEM lead times, whether the supposedly equivalent item is actually there",
      "owner": "internal",
      "current": true,
      "duration": null
    }
  },
  {
    "id": "rainer-003",
    "respondent_id": "rainer",
    "session_id": "s-p3-rainer",
    "captured_at": "2026-09-06T12:56:53Z",
    "question_id": "q1",
    "verbatim": "Everyone acts like I'm holding things up",
    "hedging": "firm",
    "polarity": "asserted",
    "subject_scope": "self",
    "entity_refs": [],
    "kind": "complaint",
    "payload": {
      "target": "Everyone",
      "affect": "annoying",
      "intensity": "passing"
    }
  },
  {
    "id": "rainer-004",
    "respondent_id": "rainer",
    "session_id": "s-p3-rainer",
    "captured_at": "2026-09-06T12:56:53Z",
    "question_id": "q1",
    "verbatim": "I can't make a customer decision without something credible to offer.",
    "hedging": "firm",
    "polarity": "asserted",
    "subject_scope": "self",
    "entity_refs": [],
    "kind": "rule",
    "payload": {
      "condition": "there is nothing credible to offer",
      "action": "I can't make a customer decision",
      "written_down": null,
      "exceptions": null
    }
  },
  {
    "id": "rainer-005",
    "respondent_id": "rainer",
    "session_id": "s-p3-rainer",
    "captured_at": "2026-09-06T12:56:53Z",
    "question_id": "q2",
    "verbatim": "Last one was an old machine part with an OEM delivery date that was ridiculous\u2014months, basically.",
    "hedging": "approximate",
    "polarity": "asserted",
    "subject_scope": "self",
    "entity_refs": [],
    "kind": "duration",
    "payload": {
      "measure": "elapsed",
      "value": {
        "low": 2,
        "high": 12,
        "unit": "month"
      },
      "subject": "OEM delivery date",
      "basis": "last_instance"
    }
  },
  {
    "id": "rainer-006",
    "respondent_id": "rainer",
    "session_id": "s-p3-rainer",
    "captured_at": "2026-09-06T12:56:53Z",
    "question_id": "q2",
    "verbatim": "Petra's information kept changing",
    "hedging": "firm",
    "polarity": "asserted",
    "subject_scope": "self",
    "entity_refs": [],
    "kind": "rework",
    "payload": {
      "what": "the substitution case",
      "returned_by": "Petra",
      "reason": "Petra's information kept changing",
      "loops_to": "deciding whether the approved alternative is acceptable"
    }
  },
  {
    "id": "rainer-007",
    "respondent_id": "rainer",
    "session_id": "s-p3-rainer",
    "captured_at": "2026-09-06T12:56:53Z",
    "question_id": "q2",
    "verbatim": "I had to decide whether an approved alternative was acceptable for that account.",
    "hedging": "firm",
    "polarity": "asserted",
    "subject_scope": "self",
    "entity_refs": [],
    "kind": "step",
    "payload": {
      "description": "decide whether an approved alternative was acceptable for that account",
      "performed_by": "Rainer",
      "frequency": null
    }
  },
  {
    "id": "rainer-008",
    "respondent_id": "rainer",
    "session_id": "s-p3-rainer",
    "captured_at": "2026-09-06T12:56:53Z",
    "question_id": "q2",
    "verbatim": "Marta sent a quote through",
    "hedging": "firm",
    "polarity": "asserted",
    "subject_scope": "self",
    "entity_refs": [],
    "kind": "handoff",
    "payload": {
      "from": "Marta",
      "to": "Rainer",
      "artifact": "a quote",
      "mechanism": "system",
      "chased": false
    }
  },
  {
    "id": "rainer-009",
    "respondent_id": "rainer",
    "session_id": "s-p3-rainer",
    "captured_at": "2026-09-06T12:56:53Z",
    "question_id": "q2",
    "verbatim": "it needed my approval",
    "hedging": "firm",
    "polarity": "asserted",
    "subject_scope": "self",
    "entity_refs": [],
    "kind": "approval",
    "payload": {
      "approver": "Rainer",
      "what_is_checked": "a quote",
      "ever_rejected": "unknown",
      "last_rejection": null
    }
  },
  {
    "id": "rainer-010",
    "respondent_id": "rainer",
    "session_id": "s-p3-rainer",
    "captured_at": "2026-09-06T12:56:53Z",
    "question_id": "q2",
    "verbatim": "which took five minutes.",
    "hedging": "firm",
    "polarity": "asserted",
    "subject_scope": "self",
    "entity_refs": [],
    "kind": "duration",
    "payload": {
      "measure": "touch",
      "value": {
        "low": 5,
        "high": 5,
        "unit": "minute"
      },
      "subject": "a quote approval",
      "basis": "typical"
    }
  },
  {
    "id": "rainer-011",
    "respondent_id": "rainer",
    "session_id": "s-p3-rainer",
    "captured_at": "2026-09-06T12:56:53Z",
    "question_id": "q2",
    "verbatim": "Except I had to check the customer history, margin, what we'd promised before",
    "hedging": "firm",
    "polarity": "asserted",
    "subject_scope": "self",
    "entity_refs": [],
    "kind": "step",
    "payload": {
      "description": "check the customer history, margin, and what we'd promised before",
      "performed_by": "Rainer",
      "frequency": "before approving a quote"
    }
  },
  {
    "id": "rainer-012",
    "respondent_id": "rainer",
    "session_id": "s-p3-rainer",
    "captured_at": "2026-09-06T12:56:53Z",
    "question_id": "q2",
    "verbatim": "so it's not really \"five minutes,\" is it?",
    "hedging": "approximate",
    "polarity": "asserted",
    "subject_scope": "self",
    "entity_refs": [],
    "kind": "complaint",
    "payload": {
      "target": "the 'five minutes' figure",
      "affect": "confusing",
      "intensity": "passing"
    }
  },
  {
    "id": "rainer-013",
    "respondent_id": "rainer",
    "session_id": "s-p3-rainer",
    "captured_at": "2026-09-06T12:56:53Z",
    "question_id": "q3",
    "verbatim": "Petra gets chased, yes.",
    "hedging": "firm",
    "polarity": "asserted",
    "subject_scope": "self",
    "entity_refs": [],
    "kind": "handoff",
    "payload": {
      "from": "Rainer",
      "to": "Petra",
      "artifact": null,
      "mechanism": "unknown",
      "chased": true
    }
  },
  {
    "id": "rainer-014",
    "respondent_id": "rainer",
    "session_id": "s-p3-rainer",
    "captured_at": "2026-09-06T12:56:53Z",
    "question_id": "q3",
    "verbatim": "Sometimes Marta, if a draft has disappeared into the system somewhere.",
    "hedging": "approximate",
    "polarity": "asserted",
    "subject_scope": "self",
    "entity_refs": [],
    "kind": "handoff",
    "payload": {
      "from": "Rainer",
      "to": "Marta",
      "artifact": "a draft",
      "mechanism": "system",
      "chased": true
    }
  },
  {
    "id": "rainer-015",
    "respondent_id": "rainer",
    "session_id": "s-p3-rainer",
    "captured_at": "2026-09-06T12:56:53Z",
    "question_id": "q3",
    "verbatim": "if a draft has disappeared into the system somewhere",
    "hedging": "firm",
    "polarity": "asserted",
    "subject_scope": "self",
    "entity_refs": [],
    "kind": "exception",
    "payload": {
      "trigger": "a draft has disappeared into the system",
      "path_taken": "chase Marta for a replacement draft",
      "pulls_in": [
        "Marta"
      ],
      "recalled_instances": null
    }
  },
  {
    "id": "rainer-016",
    "respondent_id": "rainer",
    "session_id": "s-p3-rainer",
    "captured_at": "2026-09-06T12:56:53Z",
    "question_id": "q3",
    "verbatim": "People chase me for decisions",
    "hedging": "firm",
    "polarity": "asserted",
    "subject_scope": "self",
    "entity_refs": [],
    "kind": "handoff",
    "payload": {
      "from": "People",
      "to": "Rainer",
      "artifact": "decisions",
      "mechanism": "unknown",
      "chased": false
    }
  },
  {
    "id": "rainer-017",
    "respondent_id": "rainer",
    "session_id": "s-p3-rainer",
    "captured_at": "2026-09-06T12:56:53Z",
    "question_id": "q3",
    "verbatim": "I'm with customers most of the week",
    "hedging": "firm",
    "polarity": "asserted",
    "subject_scope": "self",
    "entity_refs": [],
    "kind": "schedule",
    "payload": {
      "cadence": "most of the week",
      "batching": null,
      "driver": "That's the job"
    }
  },
  {
    "id": "rainer-018",
    "respondent_id": "rainer",
    "session_id": "s-p3-rainer",
    "captured_at": "2026-09-06T12:56:53Z",
    "question_id": "q3",
    "verbatim": "You cannot run a region from a chair staring at SAP.",
    "hedging": "firm",
    "polarity": "asserted",
    "subject_scope": "self",
    "entity_refs": [],
    "kind": "rule",
    "payload": {
      "condition": "to run a region",
      "action": "you cannot do it from a chair staring at SAP",
      "written_down": null,
      "exceptions": null
    }
  },
  {
    "id": "rainer-019",
    "respondent_id": "rainer",
    "session_id": "s-p3-rainer",
    "captured_at": "2026-09-06T12:56:53Z",
    "question_id": "q4",
    "verbatim": "Ten minutes for a substitute decision, perhaps.",
    "hedging": "approximate",
    "polarity": "asserted",
    "subject_scope": "self",
    "entity_refs": [],
    "kind": "duration",
    "payload": {
      "measure": "touch",
      "value": {
        "low": 8,
        "high": 15,
        "unit": "minute"
      },